full-dataset-jeroen_chunk1175| Alleen de ziekenhuisafdeling waar baby's worden geboren zou klinken als een kristalle kroonluchter in een woonboot, omdat de baby's nog geen tijd hebben gehad hun hartslag op elkaar af te stemmen.
full-dataset-jeroen_chunk1176_split0| En hoe vaak overkomt het je niet dat je razendsnel vandoor wilt? Alleen hebben mensen geen vleugels, nog niet althans. Dus zat ik te denken aan een hemd van vogelzaad. En van.
full-dataset-jeroen_chunk1176_split1| Om voor de hand tegen de redenen was ik razend nieuwsgierig naar wat celverdediging inhield. En het leek maar maar een goed idee dat ik naast mijn tambourijnspel ook wat andere lichaamsbeweging kreeg.
full-dataset-jeroen_chunk1176_split2| We waren met 14 leerlingen en we hadden allemaal een kool wit pak aan. We oefenden hoe je moest buigen en daarna moesten we allemaal in kleermakersit op de grond gaan zitten. En toen haalde Senzai Mark mij naar voren.
full-dataset-jeroen_chunk1176_split3| Excusez-moi, zei ik. Hij ging wijdbeend staan en zei, ik wil dat je me zo hard als je kunt in mijn kruis trapt. Hij zette zijn handen in zijn zij, haalde diep adem en deed zijn ogen dicht.
full-dataset-jeroen_chunk1176_split4| José zei ik tegen hem en ik dacht bij mezelf krijgt nou wat.
full-dataset-jeroen_chunk1177| Dit is een demonstratie van hoe het goed getrainde lichaam meegaat met een directe aanval. Kom op, trap mij met Krijs!
full-dataset-jeroen_chunk1178_split0| Ik zei, ik ben een passivist. En aangezien de meeste mensen niet weten wat dat is, draaide ik me om en legde het aan de andere uit. Ik vind niet dat je iemand in zijn kruis mag trappen, nooit.
full-dataset-jeroen_chunk1178_split1| Is het jouw grote droom om juweliersaakmeester te worden? Nee, antwoordde ik. Hoewel het inmiddels ook niet meer mijn droom is om de juweliersaak van mijn ouders over te nemen.
full-dataset-jeroen_chunk1178_split2| Ik wil alles weten, antwoordde ik, hoewel dat inmiddels ook niet meer zo is.
full-dataset-jeroen_chunk1179| Ik antwoordde......reuze boeiend. Drieënhalve maand geleden had ik mijn laatste jujitsu les.
full-dataset-jeroen_chunk1180_split0| Ik zou heel graag willen dat ik mijn tamburijn bij me had. Want door alle gebeurtenissen ben ik nog steeds in mineur en soms helpt het om een lekker ritme te trommelen.
full-dataset-jeroen_chunk1181_split0| Het is best knap dat ik de vlucht van de hommel kan spelen, want bij sommige delen moet je ongelooflijk snel roffelen. En voor mij is dat heel erg moeilijk, omdat ik nog niet zulke stevige polsen heb.
full-dataset-jeroen_chunk1181_split1| Money can't buy me love, uiteraard. Maar ik wilde weten of het een eentje mocht zijn met Zildjian Beckens. Hij zei, wat je maar wilt.
full-dataset-jeroen_chunk1182| Ik weet dat het aardig bedoeld was van hem, maar ik werd pissneidig. Yo yo, Mor! Riep ik en ik pakte hem af.
full-dataset-jeroen_chunk1183| Wat ik eigenlijk wilde zeggen was, jij bent mijn vader niet en dat zul je nooit worden ook.
full-dataset-jeroen_chunk1184| Is het niet ontzettend raar dat er steeds meer dode mensen bijkomen, terwijl de aarde even groot blijft, zodat er op een dag niet genoeg ruimte meer zal zijn om iedereen te begraven.
full-dataset-jeroen_chunk1185| Van mijn oma kreeg ik dit jaar voor mijn negende verjaardag een abonnement op National Geographic, die zij stevast de National Geographic noemt.
full-dataset-jeroen_chunk1186| Verder kreeg ik een witte blazer van haar, want ik draag alleen maar witte kleren. Maar hij zit me te ruim, dus kan ik er nog een tijdje mee doen.
full-dataset-jeroen_chunk1187_split0| En ik kreeg ook nog mijn opa's camera, die ik om twee redenen geweldig vond. Ik vroeg waarom hij hem niet had meegenomen toen hij bijna wegging. Ze antwoordde misschien wilde hij dat jij hem kreeg. Ik zei...
full-dataset-jeroen_chunk1187_split1| Ja, ja, ja.
full-dataset-jeroen_chunk1189_split0| En wat dacht je van ondergronds gebouwde wolkenkrabbers voor dode mensen?
full-dataset-jeroen_chunk1190_split0| Ik heb nog maar twee keer in mijn leven in een limousine gezeten. De eerste keer was vreselijk. Ook al was het een geweldige limousine.
full-dataset-jeroen_chunk1191| Ik vroeg of we langs school konden rijden zodat Tante Pasta en de mens me in een limousine zullen zien zitten.
full-dataset-jeroen_chunk1192| Mama zei dat de school niet op de route lag en dat we niet te laat op de begraafplaats mochten komen.
full-dataset-jeroen_chunk1193| Waarom niet? Vroeg ik. Mijn zins is een goede vraag, want als je erover nadenkt... Waarom niet?
full-dataset-jeroen_chunk1194_split0| Inmiddels ben ik het niet meer, maar vroeger was ik atheist. Wat wil zeggen dat je niet gelooft in dingen die je niet kunt waarnemen. Ik geloofde dat als je dood was, je voor altijd dood was.
full-dataset-jeroen_chunk1195| Niet dat ik nu wel geloof in dingen die je niet kunt waarnemen, want dat doe ik nog steeds niet. Maar ik geloof wel dat het allemaal uiterst ingewikkeld ligt. En bovendien... gingen wij hem niet echt begraven.
full-dataset-jeroen_chunk1196_split0| Ik vond het vervelend dat oma de hele tijd aan me zat. En probeerde ik mijn ergernis weg te stoppen. Daarom was ik maar voorin gaan zitten en poorde net zo lang in de schouder van de chauffeur tot hij me aankiek. Wat is...
full-dataset-jeroen_chunk1196_split1| Benaming.
full-dataset-jeroen_chunk1197| Wat zei?
full-dataset-jeroen_chunk1198_split0| Hij wil weten hoe u heet, zei oma vanaf de achterbank. Hij gaf me zijn kaartje. Gerald Thompson Sunshine Limousine. Voor persoonlijk vervoer in Manhattan en direct omgeving.
full-dataset-jeroen_chunk1199_split0| Ik graf een mijnkaartje en zei, Groet, Gerald, ik ben Oscar. Hij vroeg waarom ik zo praatte.
full-dataset-jeroen_chunk1199_split1| Die had ik al gezegd. En toen...
full-dataset-jeroen_chunk1200| Ik kon niet zeggen of hij me leuk vond of niet, dus zei ik... Uw zonnebril kostte 100 dollar. Hij zei... 175
full-dataset-jeroen_chunk1201| Kent u veel vieze woorden? Een bar?
full-dataset-jeroen_chunk1202| Ik mag geen vieze woorden zeggen. Baale. Wat is baale? Iets vervelends. Kan je shit doen?
full-dataset-jeroen_chunk1203| Dat is toch een vies woord? Niet als je chip zegt.
full-dataset-jeroen_chunk1204_split0| Gerald schudde zijn hoofd en hij moest een beetje lachen, maar dat was positief, want hij lachte me niet uit. En toen bedacht ik iets, dus zei ik, weet je, als limousines extreem lang waren, had je geen chauffeur meer nodig.
full-dataset-jeroen_chunk1205| En dan had ik nu naar de wedstrijd kunnen kijken.
full-dataset-jeroen_chunk1206_split0| Achterin had mama iets in haar tasje. Aan haar gespannen armspieren zag ik dat ze me tegen zich aan drukte. Oma was witte wanten aan het breien, die waren dus voor mij.
full-dataset-jeroen_chunk1206_split1| Ik heb is een Franse kip een trap in zijn maag gegeven, omdat ik hem aan het lachen wilde krijgen. Want als ik hem aan het lachen kreeg, zou ik me niet meer zo in mineur voelen. De kip zei oef.
full-dataset-jeroen_chunk1206_split2| Het is een mop. Wilt u er nog eentje horen? Of heb je oefen genoeg?
full-dataset-jeroen_chunk1207| Ik schoof weer terug, want het is gevaarlijk om te praten onder het rijden. Oma begon weer aan me te zitten, wat vervelend was. Ook al wilde ik dat ik het niet erg vond.
full-dataset-jeroen_chunk1208| Mama zei, schat, en ik antwoordde wie? En zij vroeg, heb jij soms de reservesleuken van onze flat aan de postbode gegeven? Ik zei, de postbode is een postbodin.
full-dataset-jeroen_chunk1209| Ze knikte, tegen niemand in het bijzonder en vroeg of ik de postbode in de sleutel had gegeven. Ik klikte bevestigend omdat ik voor het gebeurde nog nooit tegen haar had gelogen.
full-dataset-jeroen_chunk1210| Waarom heb je dat gedaan? vroeg ze. Dus legde ik uit, Stan......wie?
full-dataset-jeroen_chunk1211| En ik zei, Stan, de huismeester, die gaat soms even om de hoek koffie halen. En ik wil wel zeker weten dat ik alle pakjes krijg die voor mij bestemd zijn. Dus dacht ik, als Alice hier nou... wie?
full-dataset-jeroen_chunk1212| De postpod in. Als zij nou een sleutel heeft, dan kan ze de spullen binnen in de gang leggen. Maar je kunt een vreemde niet zomaar onze sleutel geven.
full-dataset-jeroen_chunk1213_split0| Gelukkig is Alicia geen vreemde. Er staan veel kostbare spullen in ons huis. Soms lijken mensen heel aardig, maar dan blijken ze uiteindelijk toch niet zo aardig te zijn, snap je? Stel nou dat ze jouw spullen pikt.
full-dataset-jeroen_chunk1214| En heeft ze jou soms de sleutel van haar huis gegeven?
full-dataset-jeroen_chunk1215| Het was duidelijk dat ze boos op me was, maar ik wist niet waarom. Ik had niets verkeerds gedaan. En zo ja, dan wist ik niet wat. En ik had het in ieder geval niet met opzet gedaan.
full-dataset-jeroen_chunk1216_split0| Ik schoof naar oma's kant in de limousine en zei tegen mama... Wat moet ik nou met een sleutel van haar huis? Ze voelde dat ik mezelf in mijn onzichtbare slaapzak dichtritste. En ik voelde dat ze niet echt van me hield.
full-dataset-jeroen_chunk1217_split0| Misschien zou je de volgende keer eerst even met mij kunnen overleggen, goed? Niet boos zijn, zei ik. Ik ben niet boos op je, zei ze. Ook niet een klein beetje? Nee.
full-dataset-jeroen_chunk1218_split0| Dit leek me niet het juiste moment om haar te vertellen dat ik ook duplicaten van de sleutel had laten maken voor de pizza bezorger. En de man van UPS.
full-dataset-jeroen_chunk1219| Ik hou meer dan ooit van je.
full-dataset-jeroen_chunk1220_split0| En fin. Ik mag geen tv kijken, maar ik mag wel documentaires, geschikt voor alle leeftijden, huren en ik mag lezen wat ik wil. Mijn lievelingsboek is A Brief History of Time.
full-dataset-jeroen_chunk1220_split1| Een van mijn favoriete passages staat aan het begin van het eerste hoofdstuk, waarin Stephen Hawking vertelt over een beroemde natuurkundige die een lezing gaf over de baan die de aarde om de zon beschijft.
full-dataset-jeroen_chunk1221_split0| Toen stak een vrouw achter in de zaal haar hand op en zei... Wat u daar vertelt is volslagenonzin.
full-dataset-jeroen_chunk1222| waarop de natuurkundige haar vroeg waarop de schildpad dan stond. En zij antwoorden... het is schildpad op schildpad op schildpad.
full-dataset-jeroen_chunk1223| Een machtig verhaal vind ik dat, want het laat zien hoe dom sommige mensen zijn. En bovendien ben ik dol op schildpadden.
full-dataset-jeroen_chunk1224_split0| Een paar weken na de zwarte dag begon ik heel veel brieven te schrijven. Ik weet niet waarom, maar het verlichtte mijn mineurstemming tenminste een beetje.
full-dataset-jeroen_chunk1224_split1| waaronder een paar die veel waard waren. En daardoor ging ik me weer afvragen of het misschien mijn bedoeling was om spullen kwijt te raken. De eerste brief die ik schreef was aan Stephen Hawking.
full-dataset-jeroen_chunk1225| Beste Stephen Hawking, mag ik alsjeblieft uw protégé zijn. Alvast bedankt. Oscar Shell
full-dataset-jeroen_chunk1226_split0| Ik had niet gedacht dat hij zou terugschrijven.
full-dataset-jeroen_chunk1227_split0| Ik stormde de 105 treden naar onze flat op, rende mijn lab in, ging mijn grote bergkast in, knipte mijn zaklantaarn aan en maakte de brief open.
full-dataset-jeroen_chunk1227_split1| Dat weet ik toevallig.
full-dataset-jeroen_chunk1228_split0| Hartelijk dank voor je brief. Vanwege het grote aantal brieven dat ik ontvang, kan ik niet iedereen persoonlijk beantwoorden. Maar weet wel dat ik elke brief lees en bewaar.
full-dataset-jeroen_chunk1229_split0| Papa stopte me altijd in en hij kon prachtige verhalen vertellen. En samen lazen we de New York Times. En soms vloot hij I am the Walrus, zijn dieveling nummer.
full-dataset-jeroen_chunk1230_split0| Wat ik ook zo geweldig vond, was dat hij in elk artikel dat we samen doorlazen wel een fout aantrof. Soms waren het stijlfouten, soms een aardrijkskundige fout of een feit dat niet klopte.
full-dataset-jeroen_chunk1231| Ik vond het heerlijk om een vader te hebben die slimmer was dan de New York Times. En ik vond het heerlijk zijn borsthaar door zijn t-shirt tegen mijn wang te voelen. En hij rook altijd zo lekker naar scheerzeep, zelfs aan het eind van de dag.
full-dataset-jeroen_chunk1232| Bij hem zijn maakte me rustig in mijn hoofd. Dan hoefde ik even niets uit te vinden.
full-dataset-jeroen_chunk1233| Toen papa me die avond instopte, de avond voor de zwarte dag, vroeg ik aan hem of de wereld een platte schijf was die rustte op de rug van een reusachtige schildpad.
full-dataset-jeroen_chunk1234| Ballon?
full-dataset-jeroen_chunk1235| Ik wil gewoon weten hoe het kan dat de aarde op zijn plek blijft hangen en niet door het heelal valt.
full-dataset-jeroen_chunk1236| Is dit wel Oscar die ik instop? Of heeft een buitenaardsweze zijn hersenen ontvreemd voor een experiment?
full-dataset-jeroen_chunk1237_split0| Ik zei, we geloven niet in buitenaardse wezens. Hij zei, de aarde valt wel degelijk door het heelal, dat weet je toch joh. Hij valt voortdurend naar de zon toe.
full-dataset-jeroen_chunk1238| Ik zei, ja, hè, hè, maar waarom is er zwaartekracht? Hij zei, hoe bedoel je waarom is er zwaartekracht? Wat is daar de reden voor?
full-dataset-jeroen_chunk1239_split0| Wie zegt dat er een reden moet zijn? Eh, niemand eigenlijk. Het was een rhetorische vraag. Wat is dat?
full-dataset-jeroen_chunk1240| Wat dan? Dat er geen reden hoeft te zijn.
full-dataset-jeroen_chunk1241| Maar als er geen reden is, waarom bestaat het heelal dan eigenlijk?
full-dataset-jeroen_chunk1242| omdat de omstandigheden gunstig waren.
full-dataset-jeroen_chunk1243| Waarom ben ik eigenlijk jouw zoon?
full-dataset-jeroen_chunk1244| Omdat mamma en ik met elkaar vrijden en een van mijn zaadjes een eitje van haar bevruchten.
full-dataset-jeroen_chunk1245| Sorry, ik moet even over mijn nek. Ik ben niet zo kinderachtig.
full-dataset-jeroen_chunk1246| Toch begrijp ik niet waarom wij bestaan. Ik bedoel niet hoe het kan, maar waarom?
full-dataset-jeroen_chunk1247| Ik keek hoe de vuurvliegjes van zijn gedachtegang een baan bescheven door zijn hoofd. Hij zei We bestaan omdat we bestaan.
full-dataset-jeroen_chunk1248| Krijg je nou wat?
full-dataset-jeroen_chunk1249| We kunnen ons allerlei Hilal voorstellen die in niets op het onze lijken. Maar dit is toevallig het Hilal dat is ontstaan.
full-dataset-jeroen_chunk1250| Ik begreep wat hij bedoelde. En ik was het niet met hem oneens, maar ook niet volkomen eens.
full-dataset-jeroen_chunk1251| Dat je nou toevallig atheist bent, wil niet zeggen dat je niet graag wilt dat dingen hun bestaansreden hebben.
full-dataset-jeroen_chunk1252| Pop.
full-dataset-jeroen_chunk1253| Ja? Wil je een verhaal vertellen? Tuurlijk. Een leuk verhaal?
full-dataset-jeroen_chunk1254| In plaats van al die saai die ik altijd vertel. Precies. Ik nestelde me zo dicht tegen hem aan dat mijn neus ongeveer in zijn oksel zat.
full-dataset-jeroen_chunk1255| En je valt me niet in de reden? Ik zal het proberen.
full-dataset-jeroen_chunk1256| Het moment vlak voordat hij aan een verhaal begon, was mijn fijnste moment.
full-dataset-jeroen_chunk1257| Ooit, lang geleden, had New York City een zesde district.
full-dataset-jeroen_chunk1258| Dus als er vroeger een zesde district was, wat zijn dan de vijf andere districten?
full-dataset-jeroen_chunk1259| Manhattan natuurlijk, Brooklyn, Queens, Staten Island en de Bronx.
full-dataset-jeroen_chunk1260| Ben ik wel eens in een van de andere districten geweest? Daar gaan we weer. Ik wil het gewoon weten. We zijn een paar jaar geleden naar de Bronx Zoo geweest. Welke nog?
full-dataset-jeroen_chunk1261| Nee. Was er echt een zesde district? Dat wil ik nou net vertellen.
full-dataset-jeroen_chunk1262| Ik zal je niet meer in de reden vallen, beloofd.
full-dataset-jeroen_chunk1263| Toen het verhaal uit was deden we de radio weer aan en troffen iemand die Frans sprak. Dat was vooral leuk omdat het me herinnerde aan de vakantie die we net achter de rug hadden en die van mij eeuwig had mogen duren.
full-dataset-jeroen_chunk1264| Na een poosje vroeg papa of ik nog wakker was. Ik zei nee, want ik wist dat hij me niet graag alleen liet als ik nog wakker was. Maar ik wilde niet dat hij de volgende ochtend moe naar zijn werk zou gaan.
full-dataset-jeroen_chunk1265| Hij gaf me een zoen op mijn voorhoofd en wenste me wel te rusten. En toen was hij bij de deur. Pap? Ja? Niks.
full-dataset-jeroen_chunk1266_split0| De eerste volgende keer dat ik zijn stem hoorde was toen ik de volgende dag uit school kwam. We mochten eerder naar huis vanwege wat er gebeurd was.
full-dataset-jeroen_chunk1267_split0| Omdat ik voortdurend op mijn horloge kijk, wist ik dat het tien uur achttien was toen ik thuiskwam. Het huis was leeg en doodstil.
full-dataset-jeroen_chunk1267_split1| Ik had toen namelijk nog geen mobieltje. En bij het uitgaan van de school had tandpasta tegen me gezegd... dat hij zou bellen om me te laten weten of hij me in het park... zijn skateboardtruc zou laten zien.
full-dataset-jeroen_chunk1268| Eigenlijk had ik daar niet zo'n zin in. Maar goed.
full-dataset-jeroen_chunk1269_split0| Eerste bericht, dinsdag 8 uur 52. Is daar iemand? Hallo? Met papa? Neem alsjeblieft even op, ik heb net de zaak gebeld, maar daar werd niet opgenomen.
full-dataset-jeroen_chunk1269_split1| Het zal vast allemaal goed komen. Ik bel nog wel even als ik wat meer weet over wat er aan de hand is.
full-dataset-jeroen_chunk1270_split0| Er waren nog vier berichten van hem. Eentje om 9 uur 12, eentje om 9 uur 31, eentje om 9 uur 46 en eentje om 10 uur 4.
full-dataset-jeroen_chunk1271| Ik keek naar de nummer weer, en zag dat hij het was.
full-dataset-jeroen_chunk1272| waarom ik niet ben waar jij bent.
full-dataset-jeroen_chunk1273| 21 mei 1963.
full-dataset-jeroen_chunk1274| aan mijn ongeboren kind.
full-dataset-jeroen_chunk1275| Ik ben niet altijd stil geweest. Vroeger praatte ik aan één stuk door, ik kon mijn mond gewoon niet houden. De stilte overviel me als een kanker.
full-dataset-jeroen_chunk1276| Het was tijdens een van mijn eerste maaltijden in Amerika en ik stamelde tegen de ober.
full-dataset-jeroen_chunk1277| Zoals u me net dat mes aanreikte, dat doet me denken aan... Maar ik kon er ze niet af maken.
full-dataset-jeroen_chunk1278_split0| Ik kon niet op haar naam komen, ik probeerde het nog eens. Maar ik wist haar naam niet meer. Ze zat in me opgesloten. Hoe vreemd, dacht ik, hoe frustrerend.
full-dataset-jeroen_chunk1279| Ik haalde een pen uit mijn zak en schreef, Anna, op mijn servetje.
full-dataset-jeroen_chunk1280| Twee dagen later overkwam hetzelfde. En een dag later opnieuw.
full-dataset-jeroen_chunk1281_split0| Zij was het enige waarover ik wilde praten. Het gebeurde steeds weer. Als ik geen pen bij me had, schreef ik Anna in de lucht.
full-dataset-jeroen_chunk1281_split1| En als ik aan de telefoon zat, toetste ik de nummers in 2662.
full-dataset-jeroen_chunk1282| En was het volgende woord dat ik kwijtraakte. Waarschijnlijk omdat het een beetje op haar naam leek. Zo'n simpel woordje om uit te spreken, zo'n belangrijk woord om te verliezen.
full-dataset-jeroen_chunk1283| Ik moest in plaats daarvan plus teken zeggen, wat bespotterlijk klonk, maar niets aan te doen. Ik wil graag koffie plus teken iets lekkers erbij. Niemand kiest ervoor zo te zijn.
full-dataset-jeroen_chunk1284_split0| Willen was een woord dat ik ook vrij snel kwijt was. Niet dat ik niets meer wilde, juist wel, maar ik kon gewoon het woord willen niet meer uitspreken. In plaats daarvan gebruikte ik verlangen.
full-dataset-jeroen_chunk1284_split1| Maar dat klopte niet helemaal. De betekenis van mijn gedachte begon van mijn weg te zweven, als bladeren die van een boom in een rivier vallen. Ik was de boom.
full-dataset-jeroen_chunk1285| Ik had nog maar een handje wolwoorden over. Als iemand iets aardigs voor me deed, zei ik tegen hem... dat woord dat voor graag gedaan komt.
full-dataset-jeroen_chunk1286| Ik was ook ja kwijt geraakt, maar ik had nog wel nee. Dus als iemand me vroeg ben jij Thomas, dan zei ik niet nee.
full-dataset-jeroen_chunk1287| Maar toen verloor ik ook nee.
full-dataset-jeroen_chunk1288| Ik ging naar een tatoeagezaak en liet op de pan van mijn linkerhand het woord ja-tatoeëren en op mijn rechterhand nee.
full-dataset-jeroen_chunk1289_split0| Wat zal ik zeggen? Het maakt je leven niet fantastisch. Het maakt je leven mogelijk. Als ik mijn handen tegen elkaar wrijf, hartje winter, warm ik mezelf aan de wrijving tussen ja en nee.
full-dataset-jeroen_chunk1289_split1| Ik geef boek aan door mijn op ingeklemde handen open te klappen. Elk boek is voor mij het evenwicht tussen ja en nee. Zelfs dit, mijn laatste.
full-dataset-jeroen_chunk1290| Brekt het mijn hart? Uiteraard. Elke seconde van elke dag. En meer stukken dan mijn hart heeft.
full-dataset-jeroen_chunk1291_split0| Me was het laatste woord dat ik hardop kon uitspreken. En dat is verschrikkelijk, maar het was niet anders. Ik liep door de straten me, me, me te roepen. Wil je een kopje koffie, Thomas?
full-dataset-jeroen_chunk1291_split1| En misschien iets lekkerst erbij? Mee
full-dataset-jeroen_chunk1292| Ik wilde de draad lostrekken, de sjaal van mijn zwijger uithalen en van voren af aan beginnen. Maar alles wat ik kon uitbrengen was meeuw.
full-dataset-jeroen_chunk1293_split0| Ik weet dat ik niet de enige ben met deze ziekte. Op straat hoor je soms oude mensen meuh meuh meuh mummelen. En soms klampen ze zich aan hun laatste woord vast. Meuh, zeggen ze, omdat ze rateloos zijn.
full-dataset-jeroen_chunk1294| En toen verloor ik ook me. En was mijn zwijgen compleet.
full-dataset-jeroen_chunk1295| Vanaf dat moment nam ik opschrijfboekjes zoals dit mee, waarin ik alle dingen opschreef die ik niet kon zeggen.
full-dataset-jeroen_chunk1297| Ik versleed honderden boekjes, duizenden. Ze lagen overal in huis.
full-dataset-jeroen_chunk1298| Ik beschouwde mijn opschrijfboekjes nooit als iets bijzonders, slechts als een noodzakelijk kwaad.
full-dataset-jeroen_chunk1299| Toen ik je moeder ontmoette, waren mijn woorden al op.
full-dataset-jeroen_chunk1300_split0| Misschien was juist daardoor ons huwelijk mogelijk. Ze hoefde me niet te leren kennen.
full-dataset-jeroen_chunk1300_split1| Ik zat in een hoekje room door mijn koffie te roeren. De zaak was half leeg. Maar toch kwam ze naast me zitten. Jij bent alles kwijt, zei ze. Alsof een geheim deelde.
full-dataset-jeroen_chunk1301_split0| Ik zweeg. Het geeft niet, fluisterde ze met haar mond vlak bij mijn oor. Ik ook. Dat zie je waarschijnlijk al van een kilometer afstand. We vallen enorm uit de toon. Moet je ze zien kijken.
full-dataset-jeroen_chunk1302_split0| Zij was de boom, maar ook de rivier die van de boom wegstroomde. Dan zijn erger dingen, zeiden ze, erger dan ons te zijn. Wij leven tenminste.
full-dataset-jeroen_chunk1302_split1| En bovendien is het schitterend weer. Dat was ik bijna vergeten te melden. Maar het schijnt dat het vanavond snecht wordt. Althans, volgens de nieuwslezer op de radio. Ik haalde mijn schouders op. Ik wist niet wat slecht betekende.
full-dataset-jeroen_chunk1302_split2| En volgens mijn huisarts is het goed voor me om in de buitenlucht te zijn. Ik heb snecht ogen en volgens hem kom ik niet genoeg buiten. En als ik er nou maar wat vaker op uitging, als ik niet zo bang was...
full-dataset-jeroen_chunk1302_split3| Daarom brak ik de vingers met mijn zwijgen. Sjajaj.
full-dataset-jeroen_chunk1303| Ik pakte mijn notitieboekje uit mijn rugzak en zocht de eerstvolgende lege bladzij. De een na laatste. Ik kan niet praten, schreef ik. Het spijt me.
full-dataset-jeroen_chunk1304| Ze bestudeerde het papiertje, keek naar mij, keek weer naar het papier, sloeg haar handen voor haar ogen en begon te huilen.
full-dataset-jeroen_chunk1305_split0| De tranen zijpelden tussen haar vingers door en vormden poeltjes in haar handen. Ze huilden en huilden maar. Er waren geen servetjes in de buurt, dus scheurde ik de bladzij uit het boekje met Ik kan niet praten.
full-dataset-jeroen_chunk1306_split0| Mijn uitleg en excuus biggelden als mascara over haar gezicht. Ze pakten mijn pen uit mijn hand en schreef op de eerstvolgende lege bladzij uit mijn opschrijfboekje de allerlaatste.
full-dataset-jeroen_chunk1307| Ik bladerde terug en wees naar... Hahaha
full-dataset-jeroen_chunk1308| Zij bladeren vooruit en wees naar trouw alsjeblieft met me.
full-dataset-jeroen_chunk1309| Ik bladerde weer terug en wees naar... Het spijt me maar, ik heb het niet kleiner.
full-dataset-jeroen_chunk1310| Zij bladeren ervoor uit en wees naar trouw alsjeblieft met me.
full-dataset-jeroen_chunk1311| Ik bladerde terug en wees naar... Geen idee, maar het is al laat.
full-dataset-jeroen_chunk1312| Ze bladeren vooruit en wees naar trouw alsjeblieft met me.
full-dataset-jeroen_chunk1313| Maar deze keer hield ze haar vinger bij alsjeblieft. Alsof ze het velletje wilde vastpinnen en een eind aan het gesprek wilde maken.
full-dataset-jeroen_chunk1314| Of alsof ze door het woord heen probeerde te drukken om bij haar ware bedoeling te komen.
full-dataset-jeroen_chunk1315_split0| Ik dacht aan het leven, aan mijn leven. De pijnlijke momenten. De kleine toevalligheden. De schaduw van wekkers op nachtkastjes. Ik dacht aan mijn kleine overwinningen en alles wat ik verwoest had zien worden.
full-dataset-jeroen_chunk1316| Ik had vreugde gekend, maar bij langer na niet genoeg. Was het ooit genoeg?
full-dataset-jeroen_chunk1317| Wat een mislukkeling ben ik, dacht ik, wat een domkop. Dom en bekrompen, waardeloos, mizerig en meeleiwekkend. Volkomen hulpeloos.
full-dataset-jeroen_chunk1318| Geen van mijn huisdieren kent zijn eigen naam. Wat voor iemand ben ik?
full-dataset-jeroen_chunk1319| Ik tilde haar vinger op als de naald van een pick-up en bladeren terug. Pagina voor pagina.
full-dataset-jeroen_chunk1320| Help.
full-dataset-jeroen_chunk1321| Googleplex.
