full-dataset-jeroen_chunk2241| Ik kon niet veel horen. En soms wist ik niet eens of iemand iets zei of dat ik het gewoon niet kon verstaan. Maar ik hoorde genoeg.
full-dataset-jeroen_chunk2242| Na het eten ging ik naar mijn kamer. Ik haalde de doos uit de kast, en de doos uit de doos, en de zakken uit, en de onafgemaakte sjaal en de telefoon.
full-dataset-jeroen_chunk2243_split0| 4e bericht, 9 uur 46. Met papa, Thomas Shell. Dit is Thomas Shell. Hallo? Kun je me horen? Is er iemand?
full-dataset-jeroen_chunk2243_split1| Nee, probeer die andere. Hallo, sorry, het is hier een gekkenhuis. Er cirkelt een helikopter rond en volgens mij gaan we zo naar het dak. Ze zeggen dat er een soort evacuatie...
full-dataset-jeroen_chunk2244| Waarom had hij geen afscheid genomen? Ik stompte mezelf. Waarom had hij niet gezegd ik houd van je?
full-dataset-jeroen_chunk2245| Waarom ik niet ben waar jij bent. 12 april 1978
full-dataset-jeroen_chunk2246| A mijn kind. Ik schrijf dit vanaf de plek waar vroeger de schuur van je moeders vader stond. Alles is vervangen. Het is nu een bibliotheek, dat zou je grootvader goed hebben gedaan.
full-dataset-jeroen_chunk2247| Ik zit aan het einde van een lange tafel omringd door encyclopedieën. Dat je geen brieven van me hebt gekregen, wil niet zeggen dat ik ze niet heb geschreven. Elke dag schrijf ik je een brief.
full-dataset-jeroen_chunk2248_split0| Soms denk ik dat als ik je kon vertellen wat me die nacht is overkomen, dat ik die nacht achter me kan laten. Dat ik misschien zelfs naar je toe kan komen. Naar huis.
full-dataset-jeroen_chunk2249| Dit schrijf ik in Dresden terwijl je moeder aan het schrijven is in de nietslogeerkamer. Althans, dat neem ik aan. Ik hoop het.
full-dataset-jeroen_chunk2250| De schrijfmachine waarop je moeder haar levensverhaal heeft getikt heb ik van Anna gekregen.
full-dataset-jeroen_chunk2251| Een paar weken voor het bombardement gaf ze die aan mij. En toen ik haar bedankte zei ze, waarom bedank je me? Het is juist een cadeau voor mij.
full-dataset-jeroen_chunk2252| Een cadeau voor jou? Je schrijft me nooit.
full-dataset-jeroen_chunk2253| Maar ik ben toch bij je.
full-dataset-jeroen_chunk2254| Je maakt al geen beeld van me, schrijf me dan in ieder geval brieven.
full-dataset-jeroen_chunk2255| Dat is de tragiek van de liefde.
full-dataset-jeroen_chunk2256| Je houdt van niet zoveel als van dat wat je mist.
full-dataset-jeroen_chunk2257_split0| Ik begon toekomstige huizen voor ons te bedenken. De hele nacht zat ik te tikken. En de volgende dag gaf ik ze aan haar. Ik bedacht tientallen huizen. Sommige waren sprookjesachtig.
full-dataset-jeroen_chunk2257_split1| Sommige waren juist heel banaal, een mooie villa ergens buiten met rozen tuinen en zwanen.
full-dataset-jeroen_chunk2258| De avond voordat ik alles verloor, tikt ik een beschrijving van ons laatste toekomstige huis.
full-dataset-jeroen_chunk2259| Lieve Anna, we gaan wonen in een hele reeks huizen, die zich omhoog slingert over de Alpen en we slapen geen nacht in hetzelfde huis.
full-dataset-jeroen_chunk2260_split0| Elke ochtend na het ontbijt glijden we op de slay naar ons volgende huis. En zodra we de voordeur open doen wordt het vorige huis gesloopt en opgebouwd tot een nieuw huis.
full-dataset-jeroen_chunk2261_split0| Toen ik dit de volgende dag ging brengen hoorde ik vlakbij je moeders huis een geluid in de schuur. Op dezelfde plek waar ik nu zit te schrijven. Heel voorzichtig haalde ik een boek uit de muur.
full-dataset-jeroen_chunk2262_split0| Jouw grootvader tilde zijn hoofd op. Hij liep naar de plank en we keken elkaar aan. Totdat het voelde of alles ieder ogenblik vlam kon vatten.
full-dataset-jeroen_chunk2263| Ik vond Anna op haar kamer.
full-dataset-jeroen_chunk2264| Dag, ik heb net je vader gezien. Hij zag er ondaan uit.
full-dataset-jeroen_chunk2265| Hij wil het niet meer aan mij doen.
full-dataset-jeroen_chunk2266| Nog even en het is allemaal voorbij, iedereen zegt dat. Dan is het allemaal voorbij en is alles weer terug bij het oude. Ze zeiden doe niet zo naïef.
full-dataset-jeroen_chunk2267| Wend je niet af, wat is er gebeurd?
full-dataset-jeroen_chunk2268| Ik had haar nog nooit zien huilen. Ik ben zwanger, zei ze.
full-dataset-jeroen_chunk2269| Ik kan niet opschrijven wat we toen tegen elkaar zeiden. Toen ik wegging zei ze, Wees alsjeblieft dolblij.
full-dataset-jeroen_chunk2270| Ik zei dat ik dat was, uiteraard. Ik kuste haar. Ik kuste haar buik. Dat was de allerlaatste keer dat ik haar zag.
full-dataset-jeroen_chunk2271| Die avond om half tien ging het luchtalarm af. Iedereen verdween naar de schuilkelders. Maar zonder haast. We waren gewend aan het alarm. We gingen ervan uit dat het vals was.
full-dataset-jeroen_chunk2272| Waarom zou iemand Dresden willen bombarderen?
full-dataset-jeroen_chunk2273| De gezinnen bij ons in de straat deden het licht in huis uit en liepen in een rij naar de schuilkelder. Ik wachtte op het stoepje en dacht aan Anna.
full-dataset-jeroen_chunk2274| Wel honderd vliegtuigen kwamen naar erbij. Enorme, zware vliegtuigen, die zich door de avondlucht ploegden als honderd walvissen door het water.
full-dataset-jeroen_chunk2275| Ze dropte hele bosjes rode vuurpijlen die het duister verlichtten voor wat er ging komen.
full-dataset-jeroen_chunk2276| De rode vuurpijlen vielen om me heen. Duizenden. Ik wist dat er iets onvoorstelbaars ging gebeuren.
full-dataset-jeroen_chunk2277_split0| Ik rende met vier treden tegelijk naar beneden. Ze zagen de uitdrukking op mijn gezicht voordat ik iets kon zeggen. Wat zou ik gezegd hebben?
full-dataset-jeroen_chunk2277_split1| alsof er een applaudisserend publiek op ons afstormde. Toen waren ze boven ons hoofd. We werden de hoeken ingeslingerd.
full-dataset-jeroen_chunk2278_split0| De muren werden van de grond getild, net lang genoeg om licht naar binnen te laten stromen. En kwamen weer met een dreun op de grond.
full-dataset-jeroen_chunk2278_split1| maar het leek er wel dagen of weken alsof het einde van de wereld nabij was. En toen hield het bombarderen op.
full-dataset-jeroen_chunk2279| Alles in orde, alles in orde, alles in orde.
full-dataset-jeroen_chunk2280_split0| We renden de kelder uit en herkenden niets meer. Er was slechts vuur waar je ook keek. Een brandend paard galopeerde voorbij.
full-dataset-jeroen_chunk2281_split0| Ik zei tegen mijn ouders dat ik Anna moest zoeken. Ik sprak af hen later bij onze voordeur weer te ontmoeten. Ik pakte de deurknop die de huid van mijn hand wegsmold.
full-dataset-jeroen_chunk2282_split0| Mijn vader schreeuwde iets tegen me. Het was de eerste keer dat hij tegen me schreeuwde. Ik kan niet opschrijven wat hij schreeuwde. Ik zei dat ik ze straks weer zou ontmoeten bij onze voordeur. Hij gaf me een klap in mijn gezicht.
full-dataset-jeroen_chunk2283_split0| Op weg naar Anna's huis begon de tweede aanval. Ik dook in de dichtstbijzijnde kelder. Die werd getroffen en wilde zich met roze rook en gouden vlammen.
full-dataset-jeroen_chunk2284_split0| Brandende apen krijsten in de bomen. Vogels zaten met brandende vleugels te zingen op de telefoonraden, waardoor geen radeloze gesprekken werden gevoerd.
full-dataset-jeroen_chunk2285| Er volgde een zilveren explosie. Iedereen probeerde tegelijk weg te komen. Dode en stervende werden onder de voet gelopen. Ik liep over een oude man. Ik liep over kinderen.
full-dataset-jeroen_chunk2286_split0| Iedereen raakte iedereen kwijt. De bommen vielen als een waterval. Ik rende tot de straten en zag gruwelijke dingen. Ik zag een blonde vrouw met brandend haar en een brandende groene jurk voorthollen met een baby.
full-dataset-jeroen_chunk2286_split1| Ik zag de resten van de mensenmassa die aan de vuurstrom had proberen te ontkomen door in de meertjes en vijvers te duiken.
full-dataset-jeroen_chunk2287_split0| De bommen bleven maar vallen, paars, oranje en wit. Ik bleef maar rennen. Mijn handen bleven maar bloeden, dwars door de dierentuin. De kooien waren opengereten, alles was overal.
full-dataset-jeroen_chunk2288| Het tweede bombardement hield op. Even abrupt en volkomen als het was begonnen.
full-dataset-jeroen_chunk2289_split0| Met verbrand haar, met zwarte armen en zwarte vingers, liep ik totaal verdoofd naar de voet van de Loswitsbrug. Ik dompelde mijn zwarte handen in het zwarte water en zag mijn weerspiegeling. Ik schrok van wat ik zag.
full-dataset-jeroen_chunk2289_split1| Mijn gespleten, bloedende lippen, mijn rode, kloppende handpalmen, zelfs nu nog, 35 jaar later.
full-dataset-jeroen_chunk2290| Ik weet nog dat ik maar één ding dacht. Blijf denken. Zolang ik denk, leef ik nog.
full-dataset-jeroen_chunk2291_split0| Maar op een gegeven moment hield ik op met denken. En daarna herinner ik me alleen nog dat ik het vreselijk koud had. Ik ontdekte dat ik op de grond lag. De pijn was onvoorstelbaar.
full-dataset-jeroen_chunk2292| Ik bewog mijn benen en armen. Waarschijnlijk werden mijn bewegingen opgemerkt door een van de soldaten die overal in de stad waren ingezet om naar overlevenden te zoeken.
full-dataset-jeroen_chunk2293| Later hoorde ik dat er meer dan 220 lijken rond de brug waren weggehaald. Vier daarvan bleken nog in leven. Ik was er een van.
full-dataset-jeroen_chunk2294| Ze legden ons in vrachtwagens en reden ons weg uit Dresden.
full-dataset-jeroen_chunk2295_split0| Vanonder de canvas flappen aan weerszijde van de vrachtwagen kijk ik naar buiten. De gebouwen stonden in brand. De bomen stonden in brand, het asfalt. Ik zag en hoorde beknelde mensen, ik rook ze ook.
full-dataset-jeroen_chunk2295_split1| Ik raakte weer buiten bewustzijn. Toen ik bijkwam lag ik in een wit ziekenhuisbed. Artsen opereerden me. Ze gaven me injecties.
full-dataset-jeroen_chunk2296| In de dagen en weken na mijn ontslag uit het ziekenhuis ging ik op zoek naar mijn ouders. En naar Anna en jou.
full-dataset-jeroen_chunk2297| Iedereen was op zoek naar iedereen tussen het puin van al die gebouwen. Maar al dat zoeken was vergeefd.
full-dataset-jeroen_chunk2298| Ik vond ons oude huis. De deur stond nog, koppig, overeind. Een paar van onze spullen hadden het overleefd. De schrijfmachine had het overleefd.
full-dataset-jeroen_chunk2299| Ik droeg hem als een baby in mijn armen. Voordat ik werd geëvacueerd schreef ik op de voordeur dat ik nog leefde.
full-dataset-jeroen_chunk2300| met het adres van het vluchtelingenkamp in Ossads. Ik wacht op een brief.
full-dataset-jeroen_chunk2301| Maar er is nooit een brief gekomen.
full-dataset-jeroen_chunk2302| Toen ik dacht dat ik doodging aan de voet van de Loschwitzbrug, dacht ik maar één ding, blijf denken. Denk eens om me in leven houden.
full-dataset-jeroen_chunk2303_split0| Maar nu leef ik en ga ik dood van het denken. Ik denk en ik denk maar. Ik kan niet ophouden met denken aan die nacht. De Boschens rode vuurpijlen.
full-dataset-jeroen_chunk2303_split1| En dat ik slechts een paar uur voor dat ik alles op de wereld verloor.
full-dataset-jeroen_chunk2304| Je tante had verteld dat ze zwanger was. Ik was dolblij.
full-dataset-jeroen_chunk2305_split0| Ik kuste haar buik. Ook al was er nog niets om te kussen. Ik zei, ik houd van ons kindje. Daar moest ze om lachen. Ze had gezegd, je houdt van een idee. Ik had gezegd...
full-dataset-jeroen_chunk2306| Daar ging het om. We hadden samen een idee. Ze vroeg of ik bang was.
full-dataset-jeroen_chunk2307| Bang voor wat?
full-dataset-jeroen_chunk2308| Ze zei, het leven is angst aanjagender dan de dood.
full-dataset-jeroen_chunk2309| Ik haalde ons toekomstige huis uit mijn zak en gaf het aan haar. Ik kuste haar. Ik kuste haar buik.
full-dataset-jeroen_chunk2310| Dat was de allerlaatste keer dat ik haar zag.
full-dataset-jeroen_chunk2311| Toen ik aan het einde van het pad was hoorde ik haar vader roepen. Hij kwam uit de schuur.
full-dataset-jeroen_chunk2312| Was ik haast vergeten, riep hij na me. Er is een brief voor je, die is gisteren bezorgd.
full-dataset-jeroen_chunk2313| Hij rolde het huis in en kwam terug met een envelop.
full-dataset-jeroen_chunk2314| Later hoorde ik dat hij het bombardement had overleefd... en zichzelf daarna van het leven had beroofd.
full-dataset-jeroen_chunk2315| Heeft je moeder je dat wel eens verteld?
full-dataset-jeroen_chunk2316| weet je het zelf eigenlijk wel.
full-dataset-jeroen_chunk2317_split0| Hij gaf me een brief die was van Simon Goldberg. De brief was verstuurd vanuit doorgangskamp Westerbork in Nederland.
full-dataset-jeroen_chunk2318_split0| Beste Thomas Shell, het was prettig je te ontmoeten. Ook al was het maar kort. Je hebt diepe indruk op hem gemaakt.
full-dataset-jeroen_chunk2318_split1| elkaar in de toekomst nog eens zullen kruisen. Tot het zover is, wens ik je het allerbeste toe in deze zware tijden. Hartelijke groeten.
full-dataset-jeroen_chunk2319_split0| De dag dat je moeder me in de bakkerij op Broadway zag zitten, wilde ik haar alles vertellen. En als ik dat had gekund, was ons leven misschien anders gelopen.
full-dataset-jeroen_chunk2320_split0| Misschien als ik had gezegd dat ik een kindje had verloren. Als ik had gezegd dat ik zo bang was om iets dierbaars te verliezen dat ik liever van helemaal niets hield.
full-dataset-jeroen_chunk2321| Misschien. Maar ik kon het niet. Ik had teveel dingen te diep in mezelf weggestopt.
full-dataset-jeroen_chunk2322| En nu ben ik hier, in plaats van daar.
full-dataset-jeroen_chunk2323| En ik zit in deze bibliotheek duizenden kilometers bij mijn leven vandaan... de zoveelste brief te schrijven die ik toch niet op de post zal doen. Hoe zeer ik ook mijn best doe en hoe graag ik het ook wil.
full-dataset-jeroen_chunk2324| Hoe heeft de jongen die achter de schuur de liefde betreft deze man kunnen worden, die aan deze tafel deze brief zitten schrijven?
full-dataset-jeroen_chunk2325| Ik hou van je. Iwara.
full-dataset-jeroen_chunk2326| Het zesde district.
full-dataset-jeroen_chunk2327| Ooit, lang geleden, had New York City een zesde district. Maar dat is een district.
full-dataset-jeroen_chunk2328| Dat noem ik nou in de redenvallen. Weet ik maar, als ik niet weet wat een district is, kan ik het verhaal niet volgen. Dat is een buurt, een aantal buurten bij elkaar.
full-dataset-jeroen_chunk2329| Dus als er vroeger een zesde district was, wat zijn dan de vijf andere districten?
full-dataset-jeroen_chunk2330| Manhattan natuurlijk, Brooklyn, Queens, Staten Island en de Bronx.
full-dataset-jeroen_chunk2331| Ben ik wel eens in een van de andere districten geweest? We zijn een paar jaar geleden naar de Bronx Zoo geweest.
full-dataset-jeroen_chunk2332| En we zijn naar Brooklyn geweest om de rozen in de Hortus botanicus te bekijken.
full-dataset-jeroen_chunk2333| Was er echt een zesde district? Dat wil ik nou net vertellen. Ik zal je niet meer in de reden vallen, beloofd.
full-dataset-jeroen_chunk2334| Wel, in de geschiedenisboekjes zul je er niet zoveel lezen. Omdat er op het indirecte bewijs in Central Park na......geen bewijs is dat het er ooit was.
full-dataset-jeroen_chunk2335_split0| Het zesde district was ook een eiland.
full-dataset-jeroen_chunk2335_split1| Van die jaarlijkse sprong werd een enorm feest gemaakt.
full-dataset-jeroen_chunk2336| Asfixiatie. Versteking.
full-dataset-jeroen_chunk2337_split0| Waarom prikten ze geen gaatjes in het deksel? In de laatste ogenblikken van hun leven graven de vuurvluchtjes heel snel achter elkaar licht.
full-dataset-jeroen_chunk2338_split0| De verspringer rende de hele breedte van Manhattan door... terwijl hij werd aangemoederd door de bewoners die zich op de stoepen hadden opgesteld... of uit de ramen van huizen en kantoren hingen, of in bomen zaten.
full-dataset-jeroen_chunk2339| De Luttele tijdspannen dat de versprenger in de lucht hing, had elke inwoner van New York het idee dat die kon vliegen.
full-dataset-jeroen_chunk2340| Of misschien is zweven een beter woord.
full-dataset-jeroen_chunk2341| Want wat de sprong zo opwindend maakte, was niet dat de versprenger van het ene district naar het andere kwam, maar dat hij zolang in de lucht bleef.
full-dataset-jeroen_chunk2342| Eén jaar, al heel veel jaar geleden, scherde de wegspringer met het puntje van zijn grote teen over het wateroppervlak van de rivier, waardoor een lichte rempeling ontstond.
full-dataset-jeroen_chunk2343| De mensen keken voor schrik toe hoe de rimpeling zich vanaf het 6e district terug naar mijn hattent verbrijden. Waardoor de potjes met vuurvliegjes als een windgong tegen elkaar gande.
full-dataset-jeroen_chunk2344| Misschien heeft hij te kopieus geluncht, zeiden ene toeschouwer tegen de andere. Of misschien is hij er te oud voor, zei iemand die zijn kinderen had meegenomen.
full-dataset-jeroen_chunk2345| Nee, reageerde de versprenger op al deze veronderstellingen. Dat was het allemaal niet. Ik maakte een prima sprong.
full-dataset-jeroen_chunk2346| Op dat moment realiseerden de mensen zich......realiseerden, ontdekten, oh ja.
full-dataset-jeroen_chunk2347| Het drong tot de mensen door. Precies zoals de rimpeling in het water door de teen was ontstaan.
full-dataset-jeroen_chunk2348| Toen de burgemeester van New York het algemene vermoeden hardop uitsprak, baan de iedereen met een zuchtLAUGHING Eicon descendent
full-dataset-jeroen_chunk2349| het zesde district beweegt.
full-dataset-jeroen_chunk2350_split0| Het zesde district dreef elk jaar een millimeter van New York af. Het ene jaar werd de hele voet van de wegsprenger nat. Een aantal jaar later ook zijn scheenbeen.
full-dataset-jeroen_chunk2350_split1| En toen kwam er een moment.
full-dataset-jeroen_chunk2351| De acht bruggen tussen Manhattan en het 6e district begonnen door te buigen en storten uiteindelijk in, een voor een in het water.
full-dataset-jeroen_chunk2352_split0| De telefoonbedrading en de elektriciteitskabels knapten, waardoor het zesde gestrict genoodzakt was om weer op ouderwetse technieken over te gaan. Met vergrootglazen warmden ze hun afhaaleten op.
full-dataset-jeroen_chunk2352_split1| De vuurvliegjes en glazen potjes, die vroeger alleen naar decoratie werden gebruikt op de grote sprongfeesten, werden nu...
full-dataset-jeroen_chunk2353| Dezelfde bouwkunderen die zich met de scheve toren van Pisa hadden bemoeid werden erbij gehaald, om hun licht over het toestand te laten schijnen.
full-dataset-jeroen_chunk2354| Het wil weg, was hun oordeel.
full-dataset-jeroen_chunk2355| Ja, en wat doen we eraan? vroeg de burgemeester van New York. Waarop zij antwoordde, daar is niets aan te doen.
full-dataset-jeroen_chunk2356_split0| Ze proberen het natuurlijk wel te redden. Hoewel redden misschien niet het juiste woord is. Want het leek zelf weg te willen. Misschien is tegenhouden meer op zijn plaats.
full-dataset-jeroen_chunk2357| Een vriendje en een vriendinnetje die een blikje met touw van het ene eiland naar het andere hadden gespannen, bij wijze van telefoon, moesten steeds meer touw laten vieren, alsof ze een vlieger steeds hoger de lucht in niet gingen.
full-dataset-jeroen_chunk2358| Het was niet zo dat de meeste zesde districtbewoners het onvermijdelijk niet wilden accepteren. Ze wilden gewoon niet weg. Ze waren blij met hun leven en wilden geen verandering.
full-dataset-jeroen_chunk2359| Dus dreven ze weg centimeter voor centimeter.
full-dataset-jeroen_chunk2360_split0| Wat ons bij Central Park brengt. Vroeger lag Central Park op een andere plek. Vroeger lag het precies in het midden van het 6e district. Het was het kloppend hart van het district.
full-dataset-jeroen_chunk2360_split1| Onherroepelijk aftreef, dat er geen redden of tegenhouden meer aan was, werd uiteindelijk per stadsreferendum besloten dat het park behouden moest blijven. Referendum, een volgstemming.
full-dataset-jeroen_chunk2360_split2| De uitslag was unaniem.
full-dataset-jeroen_chunk2361| Er werden reuzachtige haken door het meest oostelijke deel van het park geslagen. En de inwoners van New York trokken het park......als een kleed over een vloer van het testen district naar Manhattan.
full-dataset-jeroen_chunk2362| De kinderen mochten tijdens het transport op het park gaan liggen.
full-dataset-jeroen_chunk2363_split0| De lucht boven New York werd door het grootste vuurwerkspektakel uit de geschiedenis verlicht... en het Philharmonisch Orkest speelde de sterren van de hemel. De kinderen van New York lagen op hun rug, dichter in elkaar aan.
full-dataset-jeroen_chunk2364| En de kinderen werden voortgetrokken, millimeter voor millimeter, seconde na seconde, naar Manhattan. En het volwassendom.
full-dataset-jeroen_chunk2365_split0| Tegen de tijd dat het park zijn huidige lichtplaats had bereikt, lagen alle kinderen te slapen en het park vormde een mosaïek van hun dromen. Sommigen riepen iets.
full-dataset-jeroen_chunk2366| Bob? Ja?
full-dataset-jeroen_chunk2367| Ik weet heus wel dat er geen Zesterdestrict was. Ik bedoel, objectief gezien.
full-dataset-jeroen_chunk2368| Ben jij een optimist of een pessimist? Dat weet ik niet meer, wat was dat ook alweer?
full-dataset-jeroen_chunk2369| Weet je wel wat die woorden betekenen? Niet echt. Een optimist is positief en hoopvol, een pessimist is negatief en cynisch.
full-dataset-jeroen_chunk2370| Ik ben een optimist.
full-dataset-jeroen_chunk2371_split0| Nou, dat is mooi, want er is geen onweerlegbaar bewijs. Er is niets om iemand te overtuigen die niet overtuigd wil worden.
full-dataset-jeroen_chunk2372_split0| Neem nou de opvallende fossiele vondst in Central Park. Neem nou de abnormale pH-waarde in de Grote Vijver.
full-dataset-jeroen_chunk2373| Gossé. En het Zesde District? Wat is daarmee gebeurd?
full-dataset-jeroen_chunk2374_split0| Nou, waar vorige Central Park lag, zit nu een gigantisch gat. Het eiland schuift nog steeds over het aardoppervlak en fungeert als een soort lijst. Als je er doorheen kijkt, zie je wat eronder ligt.
full-dataset-jeroen_chunk2375| Antarctica.
full-dataset-jeroen_chunk2376_split0| De stoepen zijn bedekt met ijs. Het gebrandzilderde glas van de openbare bibliotheek zucht onder het gewicht van de sneeuw. Er zijn bevroren frontijnen en bevroren buurtparken.
full-dataset-jeroen_chunk2376_split1| De bevroren touwen houden hen in de lucht. Koetspaarden.
full-dataset-jeroen_chunk2377| Dat zijn de paarden die de rijtuigjes in het park trekken. Dieren mishandeling vind ik dat.
full-dataset-jeroen_chunk2378_split0| die zijn in het RAF bevroren. Vrouwen van midden 60 zijn midden in hun leven bevroren. De hamers van bevroren rechters zijn bevroren tussen schuldig en onschuldig.
full-dataset-jeroen_chunk2378_split1| en die van de laatste doodschorchel van stervenen.
full-dataset-jeroen_chunk2379| Ik wil hier niet in de reden vallen, maar... Ben je klaar?
full-dataset-jeroen_chunk2380| Eind
full-dataset-jeroen_chunk2381| Dat verhaal wordt werkelijk te gek. Daar ben ik blij om. Pap, ja, ik hou van je.
full-dataset-jeroen_chunk2382| Mijn gevoelens.
full-dataset-jeroen_chunk2383| Ik was in de logeerkamer toen het gebeurde. Ik zat televisie te kijken en een witte sjaal voor jou te breien. Het nieuws stond aan.
full-dataset-jeroen_chunk2384| De tijd ging voorbij als een hand die zwaait vanuit een trein waar ik in had willen zitten.
full-dataset-jeroen_chunk2385| Je was nog maar net naar school en ik zat alweer op je te wachten.
full-dataset-jeroen_chunk2386| Ik hoop dat jij nooit ergens zoveel aan hoeft te denken als ik aan jou.
full-dataset-jeroen_chunk2387| Ik herinner me dat ze de vader van een vermist meisje aan het interviewen waren.
full-dataset-jeroen_chunk2388| Ik herinner me zijn droevige, gladgeschoren gezicht.
full-dataset-jeroen_chunk2389| Gelooft u nog steeds dat ze levend wordt teruggevonden? Ja.
full-dataset-jeroen_chunk2390| Zijn er nieuwe aanwijzingen in de zaken? Niet dat ik weet. Maar u gelooft er nog steeds in? Ja.
full-dataset-jeroen_chunk2391| Wat zou er moeten gebeuren voordat u het opgeeft?
full-dataset-jeroen_chunk2392| Waar was het voor nodig om zo te kwellen?
full-dataset-jeroen_chunk2393| Hij bracht een hand naar zijn voorhoofd en zei, ik geef het pas op als ze gelijk vinden.
full-dataset-jeroen_chunk2394| De vrouw die de vragen stelde bracht haar hand naar haar oor. Sorry Zesje, momentje.
full-dataset-jeroen_chunk2395| Er was iets in New York gebeurd, zei ze.
full-dataset-jeroen_chunk2396_split0| Ik voelde niets toen het brandende gebouw in beeld kwam. Ik was niet eens verbaasd. Ik breidde door voor jou. En ik dacht aan de vader van dat vermiste meisje.
full-dataset-jeroen_chunk2397| Er steeg al de rook op uit een gat in het gebouw. Zwarte rook.
full-dataset-jeroen_chunk2398| Toen het tweede vliegtuig het gebouw invloog begon de verslaggever te gillen.
full-dataset-jeroen_chunk2399_split0| Uit het gebouw rolde een vuurbol die opsteeg. Er vlogen miljoenen papieren door de lucht. Ze bleven als een ring om het gebouw heenhangen. Je moeder belde. Zit je naar het nieuws te kijken? Ja.
full-dataset-jeroen_chunk2400| Ik heb ook niets van hem gehoord. Ik maak me zorgen. Hij had een bespreking in dat gebouw. En ik heb niets van hem gehoord.
full-dataset-jeroen_chunk2401| Ik liet het telefoon vallen, rende naar de wc en braakte. Ik wilde het kleed niet bederven. Toen ben ik nog eenmaal.
full-dataset-jeroen_chunk2402| Ik belde je moeder terug. Ze zei dat jij thuis was. Zo had je net gesproken.
full-dataset-jeroen_chunk2403| Ik zei dat ik bij je zou gaan kijken. Zorg dat hij het nieuws niet aanzet. Oké.
full-dataset-jeroen_chunk2404| Ze zei, met de metro is het geen doen, ik loop wel naar huis. Ik ben er over een uurtje. Ze zei, ik hou van je.
full-dataset-jeroen_chunk2405| Ze was 12 jaar met je vader getrouwd. Ik kende haar 15 jaar. Dit was de eerste keer dat ze zei dat ze van me hield.
